{
    "schemaSource": {
        "sourceType": "SCHEMA_REGISTRY_RESOURCE",
        "resourceName": "externalSchemaRegistry"
    },
    "schemaIdSource": "FROM_RECORD",
    "wireFormat": "CONFLUENT_4B",
    "validationDepth": "CONTENT",
    "nativeErrorHandling": {
        "onSubscribe": {
            "strategy": "ADD_RECORD_HEADER",
            "headerName": "X-Schema-Validation",
            "headerValue": "Schema validation failed"
        }
    }
}
