{
    "schemaSource": {
        "sourceType": "SCHEMA_REGISTRY_RESOURCE",
        "resourceName": "externalSchemaRegistry"
    },
    "schemaIdSource": "EXPRESSION",
    "wireFormat": "NONE",
    "schemaIdEvalString": "{#message.topic}-value",
    "schemaVersionEvalString": "latest",
    "validationDepth": "CONTENT",
    "nativeErrorHandling": {
        "onSubscribe": {
            "strategy": "INVALIDATE_PARTITION"
        }
    }
}
